### ISSUE TITLE
[not-really-a-BUG] frr (and others) is passing test 22-static-inter-vrf.yml only because loose arp filters

### ISSUE THREAD

**Issue by ssasso** [ipspace/netlab#2157]
FRR (and other platforms) is passing test *routing/22-static-inter-vrf.yml* only because of its ARP default behavior.

Or, better, because it is answering to a "wrong" ARP request coming from nodes *x*.
(we already encountered this)

See the first ARP Request arriving at *dut* here:
```
09:53:17.327298 ARP, Request who-has 172.16.1.1 tell 172.16.42.3, length 28
09:53:17.327314 ARP, Reply 172.16.1.1 is-at aa:c1:ab:85:e9:4e, length 28
09:53:17.327317 IP 172.16.42.3 > 172.16.41.2: ICMP echo request, id 34, seq 0, length 64
09:53:17.327351 ARP, Request who-has 172.16.1.3 tell 172.16.1.1, length 28
09:53:17.327353 ARP, Reply 172.16.1.3 is-at aa:c1:ab:5c:55:87, length 28
09:53:17.327353 IP 172.16.41.2 > 172.16.42.3: ICMP echo reply, id 34, seq 0, length 64
```

Linux (and most probably also other platforms) by default are answering to that ARP Request (`sysctl net.ipv4.conf.xxxxx.arp_filter=0`).

Some others are not, or have a different setting for `arp_filter`.

In a specific case, VyOS has a more restrictive arp_filter, for which it's not answering to the initial ARP Request - and so it's failing the test for, let's say, "no reason".

This could be solved by pinging *dut* local interface from *x* nodes before trying the inter-vrf ping.

**Comment by ssasso** [comment]
Or - maybe - instead of tweaking this test (and any future test which may have a similar approach), we can "tweak" the linux behaviour with:

```
sysctl -w net.ipv4.conf.all.arp_announce=2
```

from the kernel doc:

```
arp_announce - INTEGER
	Define different restriction levels for announcing the local
	source IP address from IP packets in ARP requests sent on
	interface:
	0 - (default) Use any local address, configured on any interface
	1 - Try to avoid local addresses that are not in the target's
	subnet for this interface. This mode is useful when target
	hosts reachable via this interface require the source IP
	address in ARP requests to be part of their logical network
	configured on the receiving interface. When we generate the
	request we will check all our subnets that include the
	target IP and will preserve the source address if it is from
	such subnet. If there is no such subnet we select source
	address according to the rules for level 2.
	2 - Always use the best local address for this target.
	In this mode we ignore the source address in the IP packet
	and try to select local address that we prefer for talks with
	the target host. Such local address is selected by looking
	for primary IP addresses on all our subnets on the outgoing
	interface that include the target IP address. If no suitable
	local address is found we select the first local address
	we have on the outgoing interface or on all other interfaces,
	with the hope we will receive reply for our request and
	even sometimes no matter the source IP address we announce.

	The max value from conf/{all,interface}/arp_announce is used.
```

**Comment by jbemmel** [comment]
> Or - maybe - instead of tweaking this test (and any future test which may have a similar approach), we can "tweak" the linux behavior with:
> 
> ```
> sysctl -w net.ipv4.conf.all.arp_announce=2
> ```
We do tweak it in case of the gateway module: https://github.com/ipspace/netlab/blob/dfa479c48fb5442616977f2d6e5539e0309ad30e/netsim/ansible/templates/gateway/frr.j2#L16

I believe Cumulus tweaks it like that for all interfaces.

We could change it globally - I have no issue with that

**Comment by ipspace** [comment]
> We could change it globally - I have no issue with that

Yeah, I'll change it globally. The default behavior is ridiculous.

**Comment by ipspace** [comment]
> Or, better, because it is answering to a "wrong" ARP request coming from nodes _x_. (we already encountered this)

About the "wrong" part... I wrote a blog post on that a few days ago (it will come out in a few days) and it turns out there's nothing in the ARP RFC saying "the source IP address in the ARP request should be in the same subnet as the destination one"

I wonder if someone will come back with a reference to another RFC... Host Requirements RFC is also useless.
