### ISSUE TITLE
[BUG] Aruba CX: MLAG orphans do not work

### ISSUE THREAD

**Issue by ipspace** [ipspace/netlab#1903]
10-mlag:
* [Test topology](https://github.com/ipspace/netlab/blob/dev/tests/integration/lag/10-mlag.yml)
* [Test results](https://tests.netlab.tools/arubacx/libvirt/lag/10-mlag.yml-validate.log)

After shutting down a LAG member link, the connectivity to the devices directly reachable over that link is broken. It looks like the data-plane packets are never sent over the peer link.

**Comment by ssasso** [comment]
Even worst 💃 

In case of a lag link failure, there a super loop of packets (in this case, arp reply) on the Inter-Switch-Link 🤦 

```
14:05:44.986930 ARP, Reply 172.16.0.5 is-at aa:c1:ab:87:f9:8f, length 28
14:05:44.986937 ARP, Reply 172.16.0.5 is-at aa:c1:ab:87:f9:8f, length 28
14:05:44.986975 ARP, Reply 172.16.0.5 is-at aa:c1:ab:87:f9:8f, length 28
14:05:44.986998 ARP, Reply 172.16.0.5 is-at aa:c1:ab:87:f9:8f, length 28
14:05:44.987029 ARP, Reply 172.16.0.5 is-at aa:c1:ab:87:f9:8f, length 28
14:05:44.987061 ARP, Reply 172.16.0.5 is-at aa:c1:ab:87:f9:8f, length 28
14:05:44.987064 ARP, Reply 172.16.0.5 is-at aa:c1:ab:87:f9:8f, length 28
14:05:44.987098 ARP, Reply 172.16.0.5 is-at aa:c1:ab:87:f9:8f, length 28
14:05:44.987104 ARP, Reply 172.16.0.5 is-at aa:c1:ab:87:f9:8f, length 28
14:05:44.987148 ARP, Reply 172.16.0.5 is-at aa:c1:ab:87:f9:8f, length 28
14:05:44.987148 ARP, Reply 172.16.0.5 is-at aa:c1:ab:87:f9:8f, length 28
14:05:44.987198 ARP, Reply 172.16.0.5 is-at aa:c1:ab:87:f9:8f, length 28
14:05:44.987243 ARP, Reply 172.16.0.5 is-at aa:c1:ab:87:f9:8f, length 28
14:05:44.987244 ARP, Reply 172.16.0.5 is-at aa:c1:ab:87:f9:8f, length 28
14:05:44.987292 ARP, Reply 172.16.0.5 is-at aa:c1:ab:87:f9:8f, length 28
14:05:44.987338 ARP, Reply 172.16.0.5 is-at aa:c1:ab:87:f9:8f, length 28
14:05:44.987360 ARP, Reply 172.16.0.5 is-at aa:c1:ab:87:f9:8f, length 28
14:05:44.987399 ARP, Reply 172.16.0.5 is-at aa:c1:ab:87:f9:8f, length 28
14:05:44.987424 ARP, Reply 172.16.0.5 is-at aa:c1:ab:87:f9:8f, length 2
14:05:44.991942 ARP, Reply 172.16.0.5 is-at aa:c1:ab:87:f9:8f, length 28
14:05:44.991947 ARP, Reply 172.16.0.5 is-at aa:c1:ab:87:f9:8f, length 28
14:05:44.991988 ARP, Reply 172.16.0.5 is-at aa:c1:ab:87:f9:8f, length 28
14:05:44.991995 ARP, Reply 172.16.0.5 is-at aa:c1:ab:87:f9:8f, length 28
14:05:44.992035 ARP, Reply 172.16.0.5 is-at aa:c1:ab:87:f9:8f, length 28
14:05:44.992055 ARP, Reply 172.16.0.5 is-at aa:c1:ab:87:f9:8f, length 28
14:05:44.992079 ARP, Reply 172.16.0.5 is-at aa:c1:ab:87:f9:8f, length 28
14:05:44.992110 ARP, Reply 172.16.0.5 is-at aa:c1:ab:87:f9:8f, length 28
14:05:44.992118 ARP, Reply 172.16.0.5 is-at aa:c1:ab:87:f9:8f, length 28
14:05:44.992158 ARP, Reply 172.16.0.5 is-at aa:c1:ab:87:f9:8f, length 28
14:05:44.992160 ARP, Reply 172.16.0.5 is-at aa:c1:ab:87:f9:8f, length 28
14:05:44.992208 ARP, Reply 172.16.0.5 is-at aa:c1:ab:87:f9:8f, length 28
14:05:44.992209 ARP, Reply 172.16.0.5 is-at aa:c1:ab:87:f9:8f, length 28
14:05:44.992251 ARP, Reply 172.16.0.5 is-at aa:c1:ab:87:f9:8f, length 28
14:05:44.992253 ARP, Reply 172.16.0.5 is-at aa:c1:ab:87:f9:8f, length 28
14:05:44.992284 ARP, Reply 172.16.0.5 is-at aa:c1:ab:87:f9:8f, length 28
14:05:44.992307 ARP, Reply 172.16.0.5 is-at aa:c1:ab:87:f9:8f, length 28
14:05:44.992339 ARP, Reply 172.16.0.5 is-at aa:c1:ab:87:f9:8f, length 28
14:05:44.992363 ARP, Reply 172.16.0.5 is-at aa:c1:ab:87:f9:8f, length 28
14:05:44.992384 ARP, Reply 172.16.0.5 is-at aa:c1:ab:87:f9:8f, length 28
14:05:44.992394 ARP, Reply 172.16.0.5 is-at aa:c1:ab:87:f9:8f, length 28
14:05:44.992402 ARP, Reply 172.16.0.5 is-at aa:c1:ab:87:f9:8f, length 28
14:05:44.992441 ARP, Reply 172.16.0.5 is-at aa:c1:ab:87:f9:8f, length 28
14:05:44.992473 ARP, Reply 172.16.0.5 is-at aa:c1:ab:87:f9:8f, length 28
14:05:44.992501 ARP, Reply 172.16.0.5 is-at aa:c1:ab:87:f9:8f, length 28
14:05:44.992538 ARP, Reply 172.16.0.5 is-at aa:c1:ab:87:f9:8f, length 28
14:05:44.992539 ARP, Reply 172.16.0.5 is-at aa:c1:ab:87:f9:8f, length 28
14:05:44.992570 ARP, Reply 172.16.0.5 is-at aa:c1:ab:87:f9:8f, length 28
14:05:44.992592 ARP, Reply 172.16.0.5 is-at aa:c1:ab:87:f9:8f, length 28
14:05:44.992640 ARP, Reply 172.16.0.5 is-at aa:c1:ab:87:f9:8f, length 28
14:05:44.992683 ARP, Reply 172.16.0.5 is-at aa:c1:ab:87:f9:8f, length 28
14:05:44.992721 ARP, Reply 172.16.0.5 is-at aa:c1:ab:87:f9:8f, length 28
14:05:44.992807 ARP, Reply 172.16.0.5 is-at aa:c1:ab:87:f9:8f, length 28
14:05:44.992892 ARP, Reply 172.16.0.5 is-at aa:c1:ab:87:f9:8f, length 28
14:05:44.992927 ARP, Reply 172.16.0.5 is-at aa:c1:ab:87:f9:8f, length 28
```

**Comment by ssasso** [comment]
OTOH, shutting down the port on `s1` - no more loops.

But the packets on the ISL on one direction is not using the VLAN tag :(

```
14:18:15.821365 aa:c1:ab:16:4c:d1 > ff:ff:ff:ff:ff:ff, ethertype 802.1Q (0x8100), length 46: vlan 1000, p 0, ethertype ARP (0x0806), Request who-has 172.16.0.5 tell 172.16.0.4, length 28
14:18:15.822148 aa:c1:ab:2f:91:5e > aa:c1:ab:16:4c:d1, ethertype ARP (0x0806), length 42: Reply 172.16.0.5 is-at aa:c1:ab:2f:91:5e, length 28
14:18:15.822459 aa:c1:ab:2f:91:5e > aa:c1:ab:16:4c:d1, ethertype ARP (0x0806), length 42: Reply 172.16.0.5 is-at aa:c1:ab:2f:91:5e, length 28
```

that's definitely a software dataplane issue (incoming packet from local port is sent to the ISL "as-is", or sth like that).

let's see what I can do...

**Comment by ipspace** [comment]
> In case of a lag link failure, there a super loop of packets (in this case, arp reply) on the Inter-Switch-Link 🤦

Lovely. I know someone who brought down a data center due to a similar problem between two Nexus switches... or was it two data centers due to a stretched VLAN? Can't remember... 🤦‍♂️

Anyway, that's where my "MLAG sucks" mantra is coming from ;)

**Comment by ssasso** [comment]
"luckily" I can guarantee that with physical AOS-CX devices everything is much more smoother :-)

**Comment by ssasso** [comment]
documenting as caveat for now.
